22:13:41.419478 IP 159.89.120.189.22 > 67.70.56.169.50544: Flags [P.], seq 934700:935472, ack 505, win 501, length 772
22:13:41.419596 IP 159.89.120.189.22 > 67.70.56.169.50544: Flags [P.], seq 935472:935628, ack 505, win 501, length 156
22:13:41.419704 IP 159.89.120.189.22 > 67.70.56.169.50544: Flags [P.], seq 935628:935784, ack 505, win 501, length 156
22:13:41.419812 IP 159.89.120.189.22 > 67.70.56.169.50544: Flags [P.], seq 935784:935940, ack 505, win 501, length 156
22:13:41.419915 IP 159.89.120.189.22 > 67.70.56.169.50544: Flags [P.], seq 935940:936096, ack 505, win 501, length 156
22:13:41.420021 IP 159.89.120.189.22 > 67.70.56.169.50544: Flags [P.], seq 936096:936252, ack 505, win 501, length 156
22:13:41.420125 IP 159.89.120.189.22 > 67.70.56.169.50544: Flags [P.], seq 936252:936408, ack 505, win 501, length 156
22:13:41.420229 IP 159.89.120.189.22 > 67.70.56.169.50544: Flags [P.], seq 936408:936564, ack 505, win 501, length 156
22:13:41.420334 IP 159.89.120.189.22 > 67.70.56.169.50544: Flags [P.], seq 936564:936720, ack 505, win 501, length 156
22:13:41.420483 IP 159.89.120.189.22 > 67.70.56.169.50544: Flags [P.], seq 936720:936876, ack 505, win 501, length 156
22:13:41.420595 IP 159.89.120.189.22 > 67.70.56.169.50544: Flags [P.], seq 936876:937032, ack 505, win 501, length 156
22:13:41.420700 IP 159.89.120.189.22 > 67.70.56.169.50544: Flags [P.], seq 937032:937188, ack 505, win 501, length 156
22:13:41.420804 IP 159.89.120.189.22 > 67.70.56.169.50544: Flags [P.], seq 937188:937344, ack 505, win 501, length 156
22:13:41.420907 IP 159.89.120.189.22 > 67.70.56.169.50544: Flags [P.], seq 937344:937500, ack 505, win 501, length 156
22:13:41.421011 IP 159.89.120.189.22 > 67.70.56.169.50544: Flags [P.], seq 937500:937656, ack 505, win 501, length 156
22:13:41.421116 IP 159.89.120.189.22 > 67.70.56.169.50544: Flags [P.], seq 937656:937812, ack 505, win 501, length 156
22:13:41.421221 IP 159.89.120.189.22 > 67.70.56.169.50544: Flags [P.], seq 937812:937968, ack 505, win 501, length 156
22:13:41.421382 IP 159.89.120.189.22 > 67.70.56.169.50544: Flags [P.], seq 937968:938124, ack 505, win 501, length 156
22:13:41.421493 IP 159.89.120.189.22 > 67.70.56.169.50544: Flags [P.], seq 938124:938280, ack 505, win 501, length 156
22:13:41.421598 IP 159.89.120.189.22 > 67.70.56.169.50544: Flags [P.], seq 938280:938436, ack 505, win 501, length 156
22:13:41.421703 IP 159.89.120.189.22 > 67.70.56.169.50544: Flags [P.], seq 938436:938592, ack 505, win 501, length 156
22:13:41.421806 IP 159.89.120.189.22 > 67.70.56.169.50544: Flags [P.], seq 938592:938748, ack 505, win 501, length 156
22:13:41.421929 IP 159.89.120.189.22 > 67.70.56.169.50544: Flags [P.], seq 938748:938904, ack 505, win 501, length 156
22:13:41.422035 IP 159.89.120.189.22 > 67.70.56.169.50544: Flags [P.], seq 938904:939060, ack 505, win 501, length 156
22:13:41.422157 IP 67.70.56.169.50544 > 159.89.120.189.22: Flags [.], ack 925452, win 8519, length 0
22:13:41.422169 IP 67.70.56.169.50544 > 159.89.120.189.22: Flags [.], ack 926596, win 8514, length 0
22:13:41.422173 IP 67.70.56.169.50544 > 159.89.120.189.22: Flags [.], ack 927220, win 8519, length 0
22:13:41.422177 IP 67.70.56.169.50544 > 159.89.120.189.22: Flags [.], ack 928780, win 8519, length 0
22:13:41.422181 IP 67.70.56.169.50544 > 159.89.120.189.22: Flags [.], ack 928936, win 8518, length 0
22:13:41.422186 IP 159.89.120.189.22 > 67.70.56.169.50544: Flags [P.], seq 939060:939216, ack 505, win 501, length 156
22:13:41.422404 IP 159.89.120.189.22 > 67.70.56.169.50544: Flags [P.], seq 939216:939884, ack 505, win 501, length 668
22:13:41.422513 IP 159.89.120.189.22 > 67.70.56.169.50544: Flags [P.], seq 939884:940040, ack 505, win 501, length 156
22:13:41.422618 IP 159.89.120.189.22 > 67.70.56.169.50544: Flags [P.], seq 940040:940196, ack 505, win 501, length 156
22:13:41.422721 IP 159.89.120.189.22 > 67.70.56.169.50544: Flags [P.], seq 940196:940352, ack 505, win 501, length 156
22:13:41.422829 IP 159.89.120.189.22 > 67.70.56.169.50544: Flags [P.], seq 940352:940508, ack 505, win 501, length 156
22:13:41.423005 IP 159.89.120.189.22 > 67.70.56.169.50544: Flags [P.], seq 940508:940664, ack 505, win 501, length 156
22:13:41.423128 IP 159.89.120.189.22 > 67.70.56.169.50544: Flags [P.], seq 940664:940820, ack 505, win 501, length 156
22:13:41.423234 IP 159.89.120.189.22 > 67.70.56.169.50544: Flags [P.], seq 940820:940976, ack 505, win 501, length 156
22:13:41.423339 IP 159.89.120.189.22 > 67.70.56.169.50544: Flags [P.], seq 940976:941132, ack 505, win 501, length 156
22:13:41.423443 IP 159.89.120.189.22 > 67.70.56.169.50544: Flags [P.], seq 941132:941288, ack 505, win 501, length 156
22:13:41.423547 IP 159.89.120.189.22 > 67.70.56.169.50544: Flags [P.], seq 941288:941444, ack 505, win 501, length 156
22:13:41.423650 IP 159.89.120.189.22 > 67.70.56.169.50544: Flags [P.], seq 941444:941600, ack 505, win 501, length 156
22:13:41.423754 IP 159.89.120.189.22 > 67.70.56.169.50544: Flags [P.], seq 941600:941756, ack 505, win 501, length 156
22:13:41.423857 IP 159.89.120.189.22 > 67.70.56.169.50544: Flags [P.], seq 941756:941912, ack 505, win 501, length 156
22:13:41.423962 IP 159.89.120.189.22 > 67.70.56.169.50544: Flags [P.], seq 941912:942068, ack 505, win 501, length 156
22:13:41.424067 IP 159.89.120.189.22 > 67.70.56.169.50544: Flags [P.], seq 942068:942224, ack 505, win 501, length 156
22:13:41.424173 IP 159.89.120.189.22 > 67.70.56.169.50544: Flags [P.], seq 942224:942380, ack 505, win 501, length 156
22:13:41.424276 IP 159.89.120.189.22 > 67.70.56.169.50544: Flags [P.], seq 942380:942536, ack 505, win 501, length 156
22:13:41.424407 IP 159.89.120.189.22 > 67.70.56.169.50544: Flags [P.], seq 942536:942692, ack 505, win 501, length 156
22:13:41.424515 IP 159.89.120.189.22 > 67.70.56.169.50544: Flags [P.], seq 942692:942848, ack 505, win 501, length 156
22:13:41.424619 IP 159.89.120.189.22 > 67.70.56.169.50544: Flags [P.], seq 942848:943004, ack 505, win 501, length 156
22:13:41.424722 IP 159.89.120.189.22 > 67.70.56.169.50544: Flags [P.], seq 943004:943160, ack 505, win 501, length 156
22:13:41.424825 IP 159.89.120.189.22 > 67.70.56.169.50544: Flags [P.], seq 943160:943316, ack 505, win 501, length 156
22:13:41.424933 IP 159.89.120.189.22 > 67.70.56.169.50544: Flags [P.], seq 943316:943472, ack 505, win 501, length 156
22:13:41.425043 IP 159.89.120.189.22 > 67.70.56.169.50544: Flags [P.], seq 943472:943628, ack 505, win 501, length 156
22:13:41.425147 IP 159.89.120.189.22 > 67.70.56.169.50544: Flags [P.], seq 943628:943784, ack 505, win 501, length 156
22:13:41.425170 IP 67.70.56.169.50544 > 159.89.120.189.22: Flags [.], ack 930800, win 8519, length 0
22:13:41.425179 IP 67.70.56.169.50544 > 159.89.120.189.22: Flags [.], ack 931736, win 8515, length 0
22:13:41.425330 IP 159.89.120.189.22 > 67.70.56.169.50544: Flags [P.], seq 943784:944148, ack 505, win 501, length 364
22:13:41.425442 IP 159.89.120.189.22 > 67.70.56.169.50544: Flags [P.], seq 944148:944304, ack 505, win 501, length 156
22:13:41.425548 IP 159.89.120.189.22 > 67.70.56.169.50544: Flags [P.], seq 944304:944460, ack 505, win 501, length 156
22:13:41.425652 IP 159.89.120.189.22 > 67.70.56.169.50544: Flags [P.], seq 944460:944616, ack 505, win 501, length 156
22:13:41.425756 IP 159.89.120.189.22 > 67.70.56.169.50544: Flags [P.], seq 944616:944772, ack 505, win 501, length 156
22:13:41.425859 IP 159.89.120.189.22 > 67.70.56.169.50544: Flags [P.], seq 944772:944928, ack 505, win 501, length 156
22:13:41.426028 IP 159.89.120.189.22 > 67.70.56.169.50544: Flags [P.], seq 944928:945084, ack 505, win 501, length 156
22:13:41.426162 IP 159.89.120.189.22 > 67.70.56.169.50544: Flags [P.], seq 945084:945240, ack 505, win 501, length 156
22:13:41.426271 IP 159.89.120.189.22 > 67.70.56.169.50544: Flags [P.], seq 945240:945396, ack 505, win 501, length 156
22:13:41.426376 IP 159.89.120.189.22 > 67.70.56.169.50544: Flags [P.], seq 945396:945552, ack 505, win 501, length 156
22:13:41.426484 IP 159.89.120.189.22 > 67.70.56.169.50544: Flags [P.], seq 945552:945708, ack 505, win 501, length 156
22:13:41.426588 IP 159.89.120.189.22 > 67.70.56.169.50544: Flags [P.], seq 945708:945864, ack 505, win 501, length 156
22:13:41.426692 IP 159.89.120.189.22 > 67.70.56.169.50544: Flags [P.], seq 945864:946020, ack 505, win 501, length 156
22:13:41.426795 IP 159.89.120.189.22 > 67.70.56.169.50544: Flags [P.], seq 946020:946176, ack 505, win 501, length 156
22:13:41.426898 IP 159.89.120.189.22 > 67.70.56.169.50544: Flags [P.], seq 946176:946332, ack 505, win 501, length 156
22:13:41.427001 IP 159.89.120.189.22 > 67.70.56.169.50544: Flags [P.], seq 946332:946488, ack 505, win 501, length 156
22:13:41.427104 IP 159.89.120.189.22 > 67.70.56.169.50544: Flags [P.], seq 946488:946644, ack 505, win 501, length 156
22:13:41.427208 IP 159.89.120.189.22 > 67.70.56.169.50544: Flags [P.], seq 946644:946800, ack 505, win 501, length 156
22:13:41.427313 IP 159.89.120.189.22 > 67.70.56.169.50544: Flags [P.], seq 946800:946956, ack 505, win 501, length 156
22:13:41.427416 IP 159.89.120.189.22 > 67.70.56.169.50544: Flags [P.], seq 946956:947112, ack 505, win 501, length 156
22:13:41.427520 IP 159.89.120.189.22 > 67.70.56.169.50544: Flags [P.], seq 947112:947268, ack 505, win 501, length 156
22:13:41.427622 IP 159.89.120.189.22 > 67.70.56.169.50544: Flags [P.], seq 947268:947424, ack 505, win 501, length 156
22:13:41.427726 IP 159.89.120.189.22 > 67.70.56.169.50544: Flags [P.], seq 947424:947580, ack 505, win 501, length 156
22:13:41.427829 IP 159.89.120.189.22 > 67.70.56.169.50544: Flags [P.], seq 947580:947736, ack 505, win 501, length 156
22:13:41.427934 IP 159.89.120.189.22 > 67.70.56.169.50544: Flags [P.], seq 947736:947892, ack 505, win 501, length 156
22:13:41.428051 IP 67.70.56.169.50544 > 159.89.120.189.22: Flags [.], ack 933452, win 8519, length 0
22:13:41.428064 IP 67.70.56.169.50544 > 159.89.120.189.22: Flags [.], ack 934388, win 8515, length 0
22:13:41.428069 IP 67.70.56.169.50544 > 159.89.120.189.22: Flags [.], ack 935784, win 8519, length 0
22:13:41.428072 IP 67.70.56.169.50544 > 159.89.120.189.22: Flags [.], ack 937500, win 8519, length 0
22:13:41.428076 IP 67.70.56.169.50544 > 159.89.120.189.22: Flags [.], ack 938124, win 8516, length 0
22:13:41.428080 IP 67.70.56.169.50544 > 159.89.120.189.22: Flags [.], ack 939060, win 8519, length 0
22:13:41.428094 IP 159.89.120.189.22 > 67.70.56.169.50544: Flags [P.], seq 947892:948048, ack 505, win 501, length 156
22:13:41.428334 IP 159.89.120.189.22 > 67.70.56.169.50544: Flags [P.], seq 948048:948820, ack 505, win 501, length 772
22:13:41.428476 IP 159.89.120.189.22 > 67.70.56.169.50544: Flags [P.], seq 948820:948976, ack 505, win 501, length 156
22:13:41.428591 IP 159.89.120.189.22 > 67.70.56.169.50544: Flags [P.], seq 948976:949132, ack 505, win 501, length 156
22:13:41.428701 IP 159.89.120.189.22 > 67.70.56.169.50544: Flags [P.], seq 949132:949288, ack 505, win 501, length 156
22:13:41.428804 IP 159.89.120.189.22 > 67.70.56.169.50544: Flags [P.], seq 949288:949444, ack 505, win 501, length 156
22:13:41.428907 IP 159.89.120.189.22 > 67.70.56.169.50544: Flags [P.], seq 949444:949600, ack 505, win 501, length 156
22:13:41.429010 IP 159.89.120.189.22 > 67.70.56.169.50544: Flags [P.], seq 949600:949756, ack 505, win 501, length 156
22:13:41.429119 IP 159.89.120.189.22 > 67.70.56.169.50544: Flags [P.], seq 949756:949912, ack 505, win 501, length 156
22:13:41.429224 IP 159.89.120.189.22 > 67.70.56.169.50544: Flags [P.], seq 949912:950068, ack 505, win 501, length 156
22:13:41.429328 IP 159.89.120.189.22 > 67.70.56.169.50544: Flags [P.], seq 950068:950224, ack 505, win 501, length 156
22:13:41.429434 IP 159.89.120.189.22 > 67.70.56.169.50544: Flags [P.], seq 950224:950380, ack 505, win 501, length 156
22:13:41.429537 IP 159.89.120.189.22 > 67.70.56.169.50544: Flags [P.], seq 950380:950536, ack 505, win 501, length 156
22:13:41.429640 IP 159.89.120.189.22 > 67.70.56.169.50544: Flags [P.], seq 950536:950692, ack 505, win 501, length 156
22:13:41.429743 IP 159.89.120.189.22 > 67.70.56.169.50544: Flags [P.], seq 950692:950848, ack 505, win 501, length 156
22:13:41.429846 IP 159.89.120.189.22 > 67.70.56.169.50544: Flags [P.], seq 950848:951004, ack 505, win 501, length 156
22:13:41.429995 IP 159.89.120.189.22 > 67.70.56.169.50544: Flags [P.], seq 951004:951160, ack 505, win 501, length 156
22:13:41.430155 IP 159.89.120.189.22 > 67.70.56.169.50544: Flags [P.], seq 951160:951316, ack 505, win 501, length 156
22:13:41.430268 IP 159.89.120.189.22 > 67.70.56.169.50544: Flags [P.], seq 951316:951472, ack 505, win 501, length 156
22:13:41.430373 IP 159.89.120.189.22 > 67.70.56.169.50544: Flags [P.], seq 951472:951628, ack 505, win 501, length 156
22:13:41.430478 IP 159.89.120.189.22 > 67.70.56.169.50544: Flags [P.], seq 951628:951784, ack 505, win 501, length 156
22:13:41.430583 IP 159.89.120.189.22 > 67.70.56.169.50544: Flags [P.], seq 951784:951940, ack 505, win 501, length 156
22:13:41.430687 IP 159.89.120.189.22 > 67.70.56.169.50544: Flags [P.], seq 951940:952096, ack 505, win 501, length 156
22:13:41.430791 IP 159.89.120.189.22 > 67.70.56.169.50544: Flags [P.], seq 952096:952252, ack 505, win 501, length 156
22:13:41.430894 IP 159.89.120.189.22 > 67.70.56.169.50544: Flags [P.], seq 952252:952408, ack 505, win 501, length 156
22:13:41.430998 IP 159.89.120.189.22 > 67.70.56.169.50544: Flags [P.], seq 952408:952564, ack 505, win 501, length 156
22:13:41.431101 IP 159.89.120.189.22 > 67.70.56.169.50544: Flags [P.], seq 952564:952720, ack 505, win 501, length 156
22:13:41.431124 IP 67.70.56.169.50544 > 159.89.120.189.22: Flags [.], ack 940820, win 8519, length 0
22:13:41.431134 IP 67.70.56.169.50544 > 159.89.120.189.22: Flags [.], ack 942068, win 8514, length 0
22:13:41.431291 IP 67.70.56.169.50544 > 159.89.120.189.22: Flags [.], ack 942380, win 8519, length 0
22:13:41.431306 IP 67.70.56.169.50544 > 159.89.120.189.22: Flags [.], ack 943316, win 8515, length 0
22:13:41.431313 IP 67.70.56.169.50544 > 159.89.120.189.22: Flags [P.], seq 505:541, ack 943316, win 8515, length 36
^C
6373 packets captured
6485 packets received by filter
111 packets dropped by kernel

